[
  {
    "id": "meinelt",
    "firstName": "Anita",
    "lastName": "Meinelt",
    "title": "Erste Bürgermeisterin",
    "mandates": [
      {
        "from": "2002-05-01",
        "to": "2020-04-30",
        "party": "csu",
        "role": "mayor"
      }
    ],
    "profile": {
      "pronouns": "sie/ihr",
      "titles": [
        {
          "title": "Erste Bürgermeisterin",
          "from": "2002-05",
          "to": "2020-05"
        }
      ]
    }
  },
  {
    "id": "dollinger",
    "firstName": "Josef",
    "lastName": "Dollinger",
    "nickname": "Sepp",
    "title": "Erster Bürgermeister",
    "mandates": [
      {
        "from": "2014-05-01",
        "to": "2020-05-01",
        "party": "fw",
        "role": "councillor"
      },
      {
        "from": "2020-05-01",
        "to": "2025-01",
        "party": "fw",
        "role": "mayor"
      },
      {
        "from": "2025-01",
        "to": "2026-04-30",
        "party": "parteilos",
        "role": "mayor"
      }
    ],
    "profile": {
      "pronouns": "er/ihn",
      "titles": [
        {
          "title": "Zweiter Bürgermeister",
          "from": "2014-05",
          "to": "2020-05"
        },
        {
          "title": "Erster Bürgermeister",
          "from": "2020-05",
          "to": "2026-05"
        }
      ],
      "contact": {
        "email": "info@josef-dollinger.de",
        "website": "josef-dollinger.de/",
        "instagram": "@dollinger.moosburg"
      }
    }
  },
  {
    "id": "mader",
    "firstName": "Maximilian",
    "lastName": "Mader",
    "nickname": "Max",
    "title": "Erster Bürgermeister",
    "mandates": [
      {
        "from": "2026-05-01",
        "party": "csu",
        "role": "mayor"
      }
    ],
    "profile": {
      "pronouns": "er/ihn",
      "titles": [
        {
          "title": "Erster Bürgermeister",
          "from": "2026-05-01",
          "to": null
        }
      ],
      "elections": [
        {
          "year": 2026,
          "listRank": 1,
          "resultRank": 1,
          "votes": 6657,
          "elected": true
        }
      ]
    }
  },
  {
    "id": "linz_karin",
    "firstName": "Karin",
    "lastName": "Linz",
    "mandates": [
      {
        "from": "2014-05-01",
        "party": "csu",
        "role": "councillor"
      }
    ],
    "profile": {
      "pronouns": "sie/ihr",
      "identity": [
        "flinta"
      ],
      "contact": {
        "email": "karin.linz@csu-moosburg.de",
        "facebook": "/karin.linz"
      },
      "elections": [
        {
          "year": 2026,
          "listRank": 3,
          "resultRank": 7,
          "votes": 3115,
          "elected": true
        }
      ]
    }
  },
  {
    "id": "heinz",
    "firstName": "Rudolf",
    "lastName": "Heinz",
    "nickname": "Rudi",
    "mandates": [
      {
        "from": "2014-05-01",
        "party": "csu",
        "role": "councillor"
      }
    ],
    "profile": {
      "pronouns": "er/ihn",
      "titles": [
        {
          "title": "Kulturreferent",
          "from": "2020-05",
          "to": null
        }
      ],
      "contact": {
        "email": "kontakt@rudolf-heinz.de",
        "website": "www.rudolf-heinz.de",
        "facebook": "/rudolf.heinz.33"
      },
      "elections": [
        {
          "year": 2026,
          "listRank": 7,
          "resultRank": 2,
          "votes": 5265,
          "elected": true
        }
      ]
    }
  },
  {
    "id": "hadersdorfer",
    "firstName": "Georg",
    "lastName": "Hadersdorfer",
    "nickname": "Hadschi",
    "title": "Ehrenamtsreferent",
    "mandates": [
      {
        "from": "2014-05-01",
        "to": "2017-10-06",
        "party": "fw",
        "role": "councillor"
      },
      {
        "from": "2017-10-06",
        "party": "csu",
        "role": "councillor"
      }
    ],
    "profile": {
      "pronouns": "er/ihn",
      "titles": [
        {
          "title": "Zweiter Bürgermeister",
          "from": "2020-05",
          "to": "2026-04-30"
        },
        {
          "title": "Ehrenamtsreferent",
          "from": "2020-05",
          "to": null
        }
      ],
      "contact": {
        "email": "c.g.hadersdorfer@gmx.de",
        "website": "www.georg-hadersdorfer.de",
        "facebook": "/georg.hadersdorfer.7"
      },
      "elections": [
        {
          "year": 2026,
          "listRank": 6,
          "resultRank": 3,
          "votes": 4923,
          "elected": true
        }
      ]
    }
  },
  {
    "id": "tristl",
    "firstName": "Manfred",
    "lastName": "Tristl",
    "nickname": "Mane",
    "mandates": [
      {
        "from": "2014-05-01",
        "party": "csu",
        "role": "councillor"
      }
    ],
    "profile": {
      "pronouns": "er/ihn",
      "contact": {
        "email": "mga.tristl@t-online.de"
      },
      "elections": [
        {
          "year": 2026,
          "listRank": 4,
          "resultRank": 5,
          "votes": 3394,
          "elected": true
        }
      ]
    }
  },
  {
    "id": "weber",
    "firstName": "Erwin",
    "lastName": "Weber",
    "mandates": [
      {
        "from": "2002-05-01",
        "to": "2026-04-30",
        "party": "csu",
        "role": "councillor"
      }
    ],
    "profile": {
      "pronouns": "er/ihn",
      "titles": [
        {
          "title": "Partnerschaftsreferent",
          "from": "2014-05-01",
          "to": "2020-04-30"
        },
        {
          "title": "Partnerschaftsreferent",
          "from": "2020-05",
          "to": "2026-05"
        }
      ],
      "contact": {
        "email": "email@erwin-weber.net",
        "facebook": "/erwin.weber.735"
      }
    }
  },
  {
    "id": "haberl",
    "firstName": "Ludwig",
    "lastName": "Haberl",
    "nickname": "Wick",
    "mandates": [
      {
        "from": "2018-11-23",
        "to": "2020-05-01",
        "party": "umb",
        "role": "councillor"
      },
      {
        "from": "2020-05-01",
        "party": "csu",
        "role": "councillor"
      }
    ],
    "succeeds": [
      "hilberg"
    ],
    "profile": {
      "pronouns": "er/ihn",
      "elections": [
        {
          "year": 2026,
          "listRank": 24,
          "resultRank": 9,
          "votes": 2663,
          "elected": false
        }
      ]
    }
  },
  {
    "id": "kehlringer",
    "firstName": "Lorena",
    "lastName": "Kehlringer",
    "mandates": [
      {
        "from": "2026-05-01",
        "party": "csu",
        "role": "councillor"
      }
    ],
    "profile": {
      "pronouns": "sie/ihr",
      "identity": [
        "flinta"
      ],
      "contact": {
        "email": "lorena.kehlringer@gmx.de",
        "instagram": "@lorenakehlringer"
      },
      "elections": [
        {
          "year": 2026,
          "listRank": 2,
          "resultRank": 8,
          "votes": 2906,
          "elected": true
        }
      ]
    }
  },
  {
    "id": "reither",
    "firstName": "Dr. Dominikus",
    "lastName": "Reither",
    "mandates": [
      {
        "from": "2026-05-01",
        "party": "csu",
        "role": "councillor"
      }
    ],
    "profile": {
      "pronouns": "er/ihn",
      "contact": {
        "email": "reither-stadtrat@web.de"
      },
      "elections": [
        {
          "year": 2026,
          "listRank": 13,
          "resultRank": 4,
          "votes": 3742,
          "elected": true
        }
      ]
    }
  },
  {
    "id": "beibl",
    "firstName": "Verena",
    "lastName": "Beibl",
    "nee": "Kuch",
    "mandates": [
      {
        "from": "2020-05-01",
        "party": "gruene",
        "role": "councillor"
      }
    ],
    "profile": {
      "pronouns": "sie/ihr",
      "identity": [
        "flinta"
      ],
      "titles": [
        {
          "title": "Sportreferentin",
          "from": "2020-05",
          "to": null
        }
      ],
      "contact": {
        "email": "verena.beibl@gruene-moosburg.de",
        "facebook": "/verena.kuch.1",
        "instagram": "@verena.kuch"
      },
      "elections": [
        {
          "year": 2026,
          "listRank": 1,
          "resultRank": 2,
          "votes": 3288,
          "elected": true
        }
      ]
    }
  },
  {
    "id": "stanglmaier",
    "firstName": "Dr. Michael",
    "lastName": "Stanglmaier",
    "title": "Dritter Bürgermeister",
    "mandates": [
      {
        "from": "2000-05-01",
        "party": "gruene",
        "role": "councillor"
      }
    ],
    "profile": {
      "pronouns": "er/ihn",
      "titles": [
        {
          "title": "Dritter Bürgermeister",
          "from": "2014-05-01",
          "to": "2020-04-30"
        },
        {
          "title": "Dritter Bürgermeister",
          "from": "2020-05",
          "to": null
        }
      ],
      "contact": {
        "email": "michael.stanglmaier@gruene-moosburg.de",
        "website": "http://www.michael-stanglmaier.eu/",
        "facebook": "/michael.stanglmaier.5",
        "instagram": "@michaelstanglmaier"
      },
      "elections": [
        {
          "year": 2026,
          "listRank": 2,
          "resultRank": 1,
          "votes": 4751,
          "elected": true
        }
      ]
    }
  },
  {
    "id": "wagner",
    "firstName": "Alfred",
    "lastName": "Wagner",
    "nickname": "Tscharlie",
    "mandates": [
      {
        "from": "2014-05-01",
        "to": "2017-02-15",
        "party": "umb",
        "role": "councillor"
      },
      {
        "from": "2017-02-15",
        "to": "2022-05-31",
        "party": "gruene",
        "role": "councillor"
      }
    ],
    "profile": {
      "pronouns": "er/ihn"
    }
  },
  {
    "id": "altenbeck",
    "firstName": "Evelin",
    "lastName": "Altenbeck",
    "nickname": "Evi",
    "mandates": [
      {
        "from": "1991-05-01",
        "to": "2022-05-31",
        "party": "gruene",
        "role": "councillor"
      }
    ],
    "profile": {
      "pronouns": "sie/ihr"
    }
  },
  {